{
  "version": "0.0.0-dev.0",
  "build_ts": "2025-12-25T10:09:54.142Z",
  "checkId": "A007",
  "checkTitle": "Altered settings",
  "timestamptz": "2025-12-25T10:11:13.961Z",
  "nodes": {
    "primary": "node-01",
    "standbys": []
  },
  "results": {
    "node-01": {
      "data": {
        "archive_command": {
          "value": "cd .",
          "unit": "",
          "category": "Write-Ahead Log / Archiving",
          "pretty_value": "cd ."
        },
        "archive_mode": {
          "value": "on",
          "unit": "",
          "category": "Write-Ahead Log / Archiving",
          "pretty_value": "on"
        },
        "archive_timeout": {
          "value": "1800",
          "unit": "s",
          "category": "Write-Ahead Log / Archiving",
          "pretty_value": "1800 s"
        },
        "auto_explain.log_analyze": {
          "value": "on",
          "unit": "",
          "category": "Customized Options",
          "pretty_value": "on"
        },
        "auto_explain.log_buffers": {
          "value": "on",
          "unit": "",
          "category": "Customized Options",
          "pretty_value": "on"
        },
        "auto_explain.log_min_duration": {
          "value": "10000",
          "unit": "ms",
          "category": "Customized Options",
          "pretty_value": "10000 ms"
        },
        "auto_explain.log_nested_statements": {
          "value": "on",
          "unit": "",
          "category": "Customized Options",
          "pretty_value": "on"
        },
        "auto_explain.log_timing": {
          "value": "off",
          "unit": "",
          "category": "Customized Options",
          "pretty_value": "off"
        },
        "auto_explain.log_triggers": {
          "value": "on",
          "unit": "",
          "category": "Customized Options",
          "pretty_value": "on"
        },
        "auto_explain.log_verbose": {
          "value": "on",
          "unit": "",
          "category": "Customized Options",
          "pretty_value": "on"
        },
        "auto_explain.sample_rate": {
          "value": "0.01",
          "unit": "",
          "category": "Customized Options",
          "pretty_value": "0.01"
        },
        "autovacuum": {
          "value": "on",
          "unit": "",
          "category": "Autovacuum",
          "pretty_value": "on"
        },
        "autovacuum_analyze_scale_factor": {
          "value": "0.01",
          "unit": "",
          "category": "Autovacuum",
          "pretty_value": "0.01"
        },
        "autovacuum_max_workers": {
          "value": "5",
          "unit": "",
          "category": "Autovacuum",
          "pretty_value": "5"
        },
        "autovacuum_naptime": {
          "value": "1",
          "unit": "s",
          "category": "Autovacuum",
          "pretty_value": "1 s"
        },
        "autovacuum_vacuum_cost_delay": {
          "value": "2",
          "unit": "ms",
          "category": "Autovacuum",
          "pretty_value": "2 ms"
        },
        "autovacuum_vacuum_cost_limit": {
          "value": "500",
          "unit": "",
          "category": "Autovacuum",
          "pretty_value": "500"
        },
        "autovacuum_vacuum_insert_scale_factor": {
          "value": "0.1",
          "unit": "",
          "category": "Autovacuum",
          "pretty_value": "0.1"
        },
        "autovacuum_vacuum_scale_factor": {
          "value": "0.01",
          "unit": "",
          "category": "Autovacuum",
          "pretty_value": "0.01"
        },
        "bgwriter_delay": {
          "value": "20",
          "unit": "ms",
          "category": "Resource Usage / Background Writer",
          "pretty_value": "20 ms"
        },
        "bgwriter_lru_maxpages": {
          "value": "1000",
          "unit": "",
          "category": "Resource Usage / Background Writer",
          "pretty_value": "1000"
        },
        "checkpoint_completion_target": {
          "value": "0.9",
          "unit": "",
          "category": "Write-Ahead Log / Checkpoints",
          "pretty_value": "0.9"
        },
        "checkpoint_timeout": {
          "value": "900",
          "unit": "s",
          "category": "Write-Ahead Log / Checkpoints",
          "pretty_value": "900 s"
        },
        "cluster_name": {
          "value": "goodvibes1",
          "unit": "",
          "category": "Reporting and Logging / Process Title",
          "pretty_value": "goodvibes1"
        },
        "config_file": {
          "value": "/etc/postgresql/17/main/postgresql.conf",
          "unit": "",
          "category": "File Locations",
          "pretty_value": "/etc/postgresql/17/main/postgresql.conf"
        },
        "data_directory": {
          "value": "/var/lib/postgresql/17/main",
          "unit": "",
          "category": "File Locations",
          "pretty_value": "/var/lib/postgresql/17/main"
        },
        "DateStyle": {
          "value": "ISO, MDY",
          "unit": "",
          "category": "Client Connection Defaults / Locale and Formatting",
          "pretty_value": "ISO, MDY"
        },
        "default_statistics_target": {
          "value": "1000",
          "unit": "",
          "category": "Query Tuning / Other Planner Options",
          "pretty_value": "1000"
        },
        "default_text_search_config": {
          "value": "pg_catalog.english",
          "unit": "",
          "category": "Client Connection Defaults / Locale and Formatting",
          "pretty_value": "pg_catalog.english"
        },
        "dynamic_shared_memory_type": {
          "value": "posix",
          "unit": "",
          "category": "Resource Usage / Memory",
          "pretty_value": "posix"
        },
        "effective_cache_size": {
          "value": "743296",
          "unit": "8kB",
          "category": "Query Tuning / Planner Cost Constants",
          "pretty_value": "5807 MB"
        },
        "effective_io_concurrency": {
          "value": "200",
          "unit": "",
          "category": "Resource Usage / Asynchronous Behavior",
          "pretty_value": "200"
        },
        "external_pid_file": {
          "value": "/var/run/postgresql/17-main.pid",
          "unit": "",
          "category": "File Locations",
          "pretty_value": "/var/run/postgresql/17-main.pid"
        },
        "hba_file": {
          "value": "/etc/postgresql/17/main/pg_hba.conf",
          "unit": "",
          "category": "File Locations",
          "pretty_value": "/etc/postgresql/17/main/pg_hba.conf"
        },
        "hot_standby": {
          "value": "on",
          "unit": "",
          "category": "Replication / Standby Servers",
          "pretty_value": "on"
        },
        "hot_standby_feedback": {
          "value": "on",
          "unit": "",
          "category": "Replication / Standby Servers",
          "pretty_value": "on"
        },
        "huge_pages": {
          "value": "try",
          "unit": "",
          "category": "Resource Usage / Memory",
          "pretty_value": "try"
        },
        "ident_file": {
          "value": "/etc/postgresql/17/main/pg_ident.conf",
          "unit": "",
          "category": "File Locations",
          "pretty_value": "/etc/postgresql/17/main/pg_ident.conf"
        },
        "idle_in_transaction_session_timeout": {
          "value": "600000",
          "unit": "ms",
          "category": "Client Connection Defaults / Statement Behavior",
          "pretty_value": "600000 ms"
        },
        "jit": {
          "value": "off",
          "unit": "",
          "category": "Query Tuning / Other Planner Options",
          "pretty_value": "off"
        },
        "lc_messages": {
          "value": "en_US.UTF-8",
          "unit": "",
          "category": "Client Connection Defaults / Locale and Formatting",
          "pretty_value": "en_US.UTF-8"
        },
        "lc_monetary": {
          "value": "en_US.UTF-8",
          "unit": "",
          "category": "Client Connection Defaults / Locale and Formatting",
          "pretty_value": "en_US.UTF-8"
        },
        "lc_numeric": {
          "value": "en_US.UTF-8",
          "unit": "",
          "category": "Client Connection Defaults / Locale and Formatting",
          "pretty_value": "en_US.UTF-8"
        },
        "lc_time": {
          "value": "en_US.UTF-8",
          "unit": "",
          "category": "Client Connection Defaults / Locale and Formatting",
          "pretty_value": "en_US.UTF-8"
        },
        "listen_addresses": {
          "value": "0.0.0.0",
          "unit": "",
          "category": "Connections and Authentication / Connection Settings",
          "pretty_value": "0.0.0.0"
        },
        "log_checkpoints": {
          "value": "on",
          "unit": "",
          "category": "Reporting and Logging / What to Log",
          "pretty_value": "on"
        },
        "log_directory": {
          "value": "/var/log/postgresql",
          "unit": "",
          "category": "Reporting and Logging / Where to Log",
          "pretty_value": "/var/log/postgresql"
        },
        "log_filename": {
          "value": "postgresql-%a.log",
          "unit": "",
          "category": "Reporting and Logging / Where to Log",
          "pretty_value": "postgresql-%a.log"
        },
        "logging_collector": {
          "value": "on",
          "unit": "",
          "category": "Reporting and Logging / Where to Log",
          "pretty_value": "on"
        },
        "log_line_prefix": {
          "value": "%t [%p-%l] %r %q%u@%d ",
          "unit": "",
          "category": "Reporting and Logging / What to Log",
          "pretty_value": "%t [%p-%l] %r %q%u@%d "
        },
        "log_lock_waits": {
          "value": "on",
          "unit": "",
          "category": "Reporting and Logging / What to Log",
          "pretty_value": "on"
        },
        "log_rotation_age": {
          "value": "1440",
          "unit": "min",